{
  "id": "aws-18-saas-and-interview",
  "slug": "saas-and-interview",
  "title": "SaaS on AWS (tenancy models and reference architecture)",
  "order": 18,
  "stage": "advanced",
  "summary": "Design multi-tenant Software as a Service (SaaS) on AWS: silo, pool, and bridge tenancy models, VPC-per-tenant versus pooled infrastructure, tenant routing, blast radius, data partitioning, noisy-neighbor fairness, and reference architectures from the SaaS Lens.",
  "officialHubs": [
    {
      "title": "SaaS Lens — AWS Well-Architected Framework",
      "url": "https://docs.aws.amazon.com/wellarchitected/latest/saas-lens/saas-lens.html"
    },
    {
      "title": "SaaS Architecture Fundamentals",
      "url": "https://docs.aws.amazon.com/wellarchitected/latest/saas-lens/saas-architecture-fundamentals.html"
    }
  ],
  "topics": [
    { "id": "aws-18-tenancy-models-silo-pool-bridge", "slug": "tenancy-models-silo-pool-bridge", "title": "Tenancy models (silo, pool, and bridge)", "order": 1 },
    { "id": "aws-18-vpc-per-tenant-vs-pool", "slug": "vpc-per-tenant-vs-pool", "title": "VPC per tenant versus pooled VPC", "order": 2 },
    { "id": "aws-18-tenant-routing-blast-radius", "slug": "tenant-routing-blast-radius", "title": "Tenant routing and blast radius", "order": 3 },
    { "id": "aws-18-data-partitioning-strategies", "slug": "data-partitioning-strategies", "title": "Data partitioning strategies (row, schema, database)", "order": 4 },
    { "id": "aws-18-noisy-neighbor-fairness", "slug": "noisy-neighbor-fairness", "title": "Noisy neighbor and fairness controls", "order": 5 },
    { "id": "aws-18-saas-reference-architecture", "slug": "saas-reference-architecture", "title": "SaaS reference architecture (control plane and data plane)", "order": 6 }
  ]
}
