{
  "id": "aws-07-perimeter-and-gateways",
  "slug": "perimeter-and-gateways",
  "title": "Perimeter and gateways (firewalls, load balancers, API edge)",
  "order": 7,
  "stage": "foundation",
  "summary": "Defend and route traffic at the network edge. Security groups as stateful Elastic Network Interface (ENI) firewalls, Network Access Control Lists (NACLs) as stateless subnet boundaries, Application Load Balancer (ALB) versus Network Load Balancer (NLB) versus Gateway Load Balancer (GWLB), API Gateway flavors, AWS WAF and Shield, and the full client-to-target request path.",
  "officialHubs": [
    {
      "title": "Security groups for your VPC",
      "url": "https://docs.aws.amazon.com/vpc/latest/userguide/vpc-security-groups.html"
    },
    {
      "title": "Elastic Load Balancing",
      "url": "https://docs.aws.amazon.com/elasticloadbalancing/latest/userguide/what-is-load-balancing.html"
    }
  ],
  "topics": [
    {
      "id": "aws-07-security-groups",
      "slug": "security-groups",
      "title": "Security groups (stateful ENI firewall)",
      "order": 1
    },
    {
      "id": "aws-07-network-acls",
      "slug": "network-acls",
      "title": "Network ACLs (stateless subnet boundary)",
      "order": 2
    },
    {
      "id": "aws-07-alb-nlb-gwlb",
      "slug": "alb-nlb-gwlb",
      "title": "ALB versus NLB versus GWLB",
      "order": 3
    },
    {
      "id": "aws-07-api-gateway",
      "slug": "api-gateway",
      "title": "API Gateway (HTTP versus REST versus WebSocket)",
      "order": 4
    },
    {
      "id": "aws-07-waf-shield",
      "slug": "waf-shield",
      "title": "AWS WAF and Shield (perimeter hardening)",
      "order": 5
    },
    {
      "id": "aws-07-full-request-path",
      "slug": "full-request-path",
      "title": "Full request path (client to target)",
      "order": 6
    }
  ]
}
