{
  "id": "javascript-13-promises-async-event-loop",
  "slug": "promises-async-event-loop",
  "title": "Promises, async/await, and the event loop",
  "order": 13,
  "stage": "intermediate",
  "summary": "Promise states, chaining, Promise.all/race/any, async/await, microtasks versus macrotasks, AbortController, and comparisons to C# Task.",
  "officialHubs": [
    {
      "title": "MDN JavaScript guide",
      "url": "https://developer.mozilla.org/en-US/docs/Web/JavaScript/Guide"
    },
    {
      "title": "javascript.info",
      "url": "https://javascript.info/"
    }
  ],
  "topics": [
    {
      "id": "javascript-13-why-async-javascript",
      "slug": "why-async-javascript",
      "title": "Why async JavaScript exists (I/O without blocking the thread)",
      "order": 1
    },
    {
      "id": "javascript-13-promise-states-and-chaining",
      "slug": "promise-states-and-chaining",
      "title": "Promise states, then/catch/finally, and chaining",
      "order": 2
    },
    {
      "id": "javascript-13-promise-combinators",
      "slug": "promise-combinators",
      "title": "Promise.all, race, any, and allSettled",
      "order": 3
    },
    {
      "id": "javascript-13-async-await-syntax",
      "slug": "async-await-syntax",
      "title": "async/await syntax and error handling",
      "order": 4
    },
    {
      "id": "javascript-13-microtasks-vs-macrotasks",
      "slug": "microtasks-vs-macrotasks",
      "title": "Microtasks versus macrotasks (event loop ordering)",
      "order": 5
    },
    {
      "id": "javascript-13-implementing-promise-from-scratch",
      "slug": "implementing-promise-from-scratch",
      "title": "Implementing a Promise/A+ subset from scratch",
      "order": 6
    },
    {
      "id": "javascript-13-abort-controller-cancellation",
      "slug": "abort-controller-cancellation",
      "title": "AbortController, signals, and cooperative cancellation",
      "order": 7
    },
    {
      "id": "javascript-13-async-concurrency-limits",
      "slug": "async-concurrency-limits",
      "title": "Concurrency-limited async mapping (pool pattern)",
      "order": 8
    },
    {
      "id": "javascript-13-promises-vs-csharp-task",
      "slug": "promises-vs-csharp-task",
      "title": "Promises versus C# Task and ValueTask",
      "order": 9
    }
  ]
}
