{
  "id": "aws-10-s3-storage",
  "slug": "s3-storage",
  "title": "Amazon S3 object storage (buckets, durability, security, events)",
  "order": 10,
  "stage": "intermediate",
  "summary": "Amazon Simple Storage Service (S3) stores objects in buckets with virtually unlimited scale. Learn bucket naming, keys and prefixes, durability and consistency models, storage classes and lifecycle, bucket policies and access control, and event-driven patterns including static website hosting and Lambda triggers.",
  "officialHubs": [
    {
      "title": "Amazon S3 User Guide",
      "url": "https://docs.aws.amazon.com/AmazonS3/latest/userguide/Welcome.html"
    },
    {
      "title": "S3 security best practices",
      "url": "https://docs.aws.amazon.com/AmazonS3/latest/userguide/security-best-practices.html"
    }
  ],
  "topics": [
    {
      "id": "aws-10-s3-buckets-keys-prefixes",
      "slug": "s3-buckets-keys-prefixes",
      "title": "S3 buckets, object keys, and prefixes",
      "order": 1
    },
    {
      "id": "aws-10-s3-durability-consistency",
      "slug": "s3-durability-consistency",
      "title": "S3 durability, availability, and consistency",
      "order": 2
    },
    {
      "id": "aws-10-s3-storage-classes",
      "slug": "s3-storage-classes",
      "title": "S3 storage classes and lifecycle policies",
      "order": 3
    },
    {
      "id": "aws-10-s3-security-policies",
      "slug": "s3-security-policies",
      "title": "S3 security — bucket policies, ACLs, and encryption",
      "order": 4
    },
    {
      "id": "aws-10-s3-events-hosting",
      "slug": "s3-events-hosting",
      "title": "S3 event notifications and static website hosting",
      "order": 5
    }
  ]
}
