{
  "id": "dotnet-09-entity-framework-core",
  "slug": "entity-framework-core",
  "title": "Entity Framework Core for Web APIs",
  "order": 9,
  "stage": "intermediate",
  "summary": "DbContext lifetime, change tracking, AsNoTracking, N+1 queries, pagination, indexes, optimistic concurrency with RowVersion, and repository patterns for APIs.",
  "officialHubs": [
    { "title": "EF Core documentation", "url": "https://learn.microsoft.com/en-us/ef/core/" },
    { "title": "DbContext lifetime in ASP.NET Core", "url": "https://learn.microsoft.com/en-us/ef/core/dbcontext-configuration/" }
  ],
  "topics": [
    { "id": "dotnet-09-ef-core-basics", "slug": "ef-core-basics", "title": "EF Core basics for APIs (DbContext, DbSet, LINQ)", "order": 1 },
    { "id": "dotnet-09-dbcontext-lifetime", "slug": "dbcontext-lifetime", "title": "DbContext lifetime (scoped per request, thread safety)", "order": 2 },
    { "id": "dotnet-09-tracking-vs-notracking", "slug": "tracking-vs-notracking", "title": "Change tracking versus AsNoTracking (read vs write paths)", "order": 3 },
    { "id": "dotnet-09-n-plus-one-queries", "slug": "n-plus-one-queries", "title": "N+1 queries (Include, split queries, projection)", "order": 4 },
    { "id": "dotnet-09-pagination-patterns", "slug": "pagination-patterns", "title": "Pagination patterns (offset vs cursor, total count tradeoffs)", "order": 5 },
    { "id": "dotnet-09-optimistic-concurrency", "slug": "optimistic-concurrency", "title": "Optimistic concurrency (RowVersion, 409 Conflict)", "order": 6 },
    { "id": "dotnet-09-repository-vs-direct-dbcontext", "slug": "repository-vs-direct-dbcontext", "title": "Repository pattern versus direct DbContext (when each helps)", "order": 7 }
  ]
}
