{
  "id": "aws-13-step-functions",
  "slug": "step-functions",
  "title": "AWS Step Functions orchestration",
  "order": 13,
  "stage": "intermediate",
  "summary": "AWS Step Functions coordinates distributed work as state machines defined in Amazon States Language (ASL). Learn Task, Choice, Parallel, and Map states; Standard versus Express workflows; saga compensation patterns; and wiring Lambda and SQS into durable orchestration — the control plane senior engineers use when cron-plus-Lambda is no longer enough.",
  "officialHubs": [
    {
      "title": "AWS Step Functions developer guide",
      "url": "https://docs.aws.amazon.com/step-functions/latest/dg/welcome.html"
    },
    {
      "title": "Amazon States Language specification",
      "url": "https://docs.aws.amazon.com/step-functions/latest/dg/concepts-amazon-states-language.html"
    }
  ],
  "topics": [
    {
      "id": "aws-13-step-functions-states",
      "slug": "step-functions-states",
      "title": "Step Functions state types (Task, Choice, Parallel, Map)",
      "order": 1
    },
    {
      "id": "aws-13-step-functions-standard-express",
      "slug": "step-functions-standard-express",
      "title": "Standard versus Express workflows (durability and cost)",
      "order": 2
    },
    {
      "id": "aws-13-step-functions-saga",
      "slug": "step-functions-saga",
      "title": "Saga patterns with Step Functions (compensation and rollback)",
      "order": 3
    },
    {
      "id": "aws-13-step-functions-lambda-sqs",
      "slug": "step-functions-lambda-sqs",
      "title": "Step Functions with Lambda and SQS (orchestrated workers)",
      "order": 4
    }
  ]
}
