{
  "id": "typescript-15-advanced-type-patterns",
  "slug": "advanced-type-patterns",
  "title": "Advanced type-level patterns",
  "order": 15,
  "stage": "advanced",
  "summary": "Recursive types, branded types, opaque types, builder pattern typing, satisfies with generics, and type-level programming limits.",
  "officialHubs": [
    {
      "title": "TypeScript handbook",
      "url": "https://www.typescriptlang.org/docs/handbook/intro.html"
    },
    {
      "title": "TypeScript release notes",
      "url": "https://www.typescriptlang.org/docs/handbook/release-notes/overview.html"
    }
  ],
  "topics": [
    {
      "id": "typescript-15-branded-and-opaque-types",
      "slug": "branded-and-opaque-types",
      "title": "Branded and opaque types for domain safety",
      "order": 1
    },
    {
      "id": "typescript-15-recursive-types",
      "slug": "recursive-types",
      "title": "Recursive types and depth limits",
      "order": 2
    },
    {
      "id": "typescript-15-builder-pattern-typing",
      "slug": "builder-pattern-typing",
      "title": "Builder pattern with progressive type safety",
      "order": 3
    },
    {
      "id": "typescript-15-type-level-programming-limits",
      "slug": "type-level-programming-limits",
      "title": "When to stop: readability versus clever types",
      "order": 4
    },
    {
      "id": "typescript-15-advanced-patterns-vs-csharp",
      "slug": "advanced-patterns-vs-csharp",
      "title": "Advanced TS patterns versus C# source generators",
      "order": 5
    }
  ]
}
