{
  "id": "dotnet-04-middleware-pipeline",
  "slug": "middleware-pipeline",
  "title": "The middleware pipeline (request processing)",
  "order": 4,
  "stage": "foundation",
  "summary": "The onion model, middleware registration order, exception handling, custom middleware, short-circuiting, and resolving scoped services per request — the #1 ASP.NET Core interview topic.",
  "officialHubs": [
    { "title": "ASP.NET Core middleware", "url": "https://learn.microsoft.com/en-us/aspnet/core/fundamentals/middleware/" },
    { "title": "Write custom middleware", "url": "https://learn.microsoft.com/en-us/aspnet/core/fundamentals/middleware/write" }
  ],
  "topics": [
    { "id": "dotnet-04-pipeline-onion-model", "slug": "pipeline-onion-model", "title": "The pipeline onion model (in-order in, reverse out)", "order": 1 },
    { "id": "dotnet-04-middleware-order", "slug": "middleware-order", "title": "Middleware order (exception handling, routing, auth, endpoints)", "order": 2 },
    { "id": "dotnet-04-exception-handling-middleware", "slug": "exception-handling-middleware", "title": "Exception handling middleware (UseExceptionHandler)", "order": 3 },
    { "id": "dotnet-04-custom-middleware", "slug": "custom-middleware", "title": "Writing custom middleware (InvokeAsync pattern)", "order": 4 },
    { "id": "dotnet-04-short-circuiting", "slug": "short-circuiting", "title": "Short-circuiting requests (Run, Map, conditional branches)", "order": 5 },
    { "id": "dotnet-04-scoped-services-in-middleware", "slug": "scoped-services-in-middleware", "title": "Scoped services in middleware (constructor vs InvokeAsync)", "order": 6 }
  ]
}
