{
  "id": "javascript-08-collections-and-iterators",
  "slug": "collections-and-iterators",
  "title": "Collections, iterators, and generators",
  "order": 8,
  "stage": "intermediate",
  "summary": "Array, Map, Set, WeakMap, WeakSet, typed arrays, iterators, generators, yield, and performance tradeoffs for cache keys and large datasets.",
  "officialHubs": [
    {
      "title": "MDN JavaScript guide",
      "url": "https://developer.mozilla.org/en-US/docs/Web/JavaScript/Guide"
    },
    {
      "title": "javascript.info",
      "url": "https://javascript.info/"
    }
  ],
  "topics": [
    {
      "id": "javascript-08-arrays-and-typed-arrays",
      "slug": "arrays-and-typed-arrays",
      "title": "Array, typed arrays, and array-like objects",
      "order": 1
    },
    {
      "id": "javascript-08-map-set-weak-collections",
      "slug": "map-set-weak-collections",
      "title": "Map, Set, WeakMap, and WeakSet",
      "order": 2
    },
    {
      "id": "javascript-08-iterators-and-for-of",
      "slug": "iterators-and-for-of",
      "title": "Iterators, Symbol.iterator, and for-of",
      "order": 3
    },
    {
      "id": "javascript-08-generators-and-yield",
      "slug": "generators-and-yield",
      "title": "Generators, yield, and lazy sequences",
      "order": 4
    },
    {
      "id": "javascript-08-collection-performance",
      "slug": "collection-performance",
      "title": "When to use Map versus Object and Set versus Array",
      "order": 5
    },
    {
      "id": "javascript-08-immutable-patterns",
      "slug": "immutable-patterns",
      "title": "Immutability patterns: spread, structuredClone, and tradeoffs",
      "order": 6
    },
    {
      "id": "javascript-08-collections-vs-csharp",
      "slug": "collections-vs-csharp",
      "title": "JavaScript collections versus C# List and Dictionary",
      "order": 7
    }
  ]
}
