{
  "id": "javascript-04-functions-scope-closures",
  "slug": "functions-scope-closures",
  "title": "Functions, scope, and closures",
  "order": 4,
  "stage": "foundation",
  "summary": "Function declarations, expressions, arrow functions, parameters, rest/spread, scope chain, closures, IIFEs, and the classic loop-with-var interview trap.",
  "officialHubs": [
    {
      "title": "MDN JavaScript guide",
      "url": "https://developer.mozilla.org/en-US/docs/Web/JavaScript/Guide"
    },
    {
      "title": "javascript.info",
      "url": "https://javascript.info/"
    }
  ],
  "topics": [
    {
      "id": "javascript-04-function-forms",
      "slug": "function-forms",
      "title": "Function declarations, expressions, and arrow functions",
      "order": 1
    },
    {
      "id": "javascript-04-parameters-rest-defaults",
      "slug": "parameters-rest-defaults",
      "title": "Parameters, default values, and rest parameters",
      "order": 2
    },
    {
      "id": "javascript-04-lexical-scope-and-scope-chain",
      "slug": "lexical-scope-and-scope-chain",
      "title": "Lexical scope and the scope chain",
      "order": 3
    },
    {
      "id": "javascript-04-closures-and-capture",
      "slug": "closures-and-capture",
      "title": "Closures, capture, and the loop-with-var trap",
      "order": 4
    },
    {
      "id": "javascript-04-iife-and-module-pattern",
      "slug": "iife-and-module-pattern",
      "title": "IIFEs and the module pattern before ESM",
      "order": 5
    },
    {
      "id": "javascript-04-higher-order-functions",
      "slug": "higher-order-functions",
      "title": "Higher-order functions and callbacks as values",
      "order": 6
    },
    {
      "id": "javascript-04-recursion-and-call-stack-limits",
      "slug": "recursion-and-call-stack-limits",
      "title": "Recursion, stack overflow, and tail calls",
      "order": 7
    }
  ]
}
