{
  "id": "typescript-16-decorators-and-metadata",
  "slug": "decorators-and-metadata",
  "title": "Decorators and experimental metadata",
  "order": 16,
  "stage": "advanced",
  "summary": "Stage 3 decorators, legacy decorators, reflect-metadata, parameter decorators, and framework integration patterns.",
  "officialHubs": [
    {
      "title": "TypeScript handbook",
      "url": "https://www.typescriptlang.org/docs/handbook/intro.html"
    },
    {
      "title": "TypeScript release notes",
      "url": "https://www.typescriptlang.org/docs/handbook/release-notes/overview.html"
    }
  ],
  "topics": [
    {
      "id": "typescript-16-stage-3-decorators",
      "slug": "stage-3-decorators",
      "title": "Stage 3 decorators and decorator factories",
      "order": 1
    },
    {
      "id": "typescript-16-legacy-decorators",
      "slug": "legacy-decorators",
      "title": "Legacy (experimental) decorators and migration",
      "order": 2
    },
    {
      "id": "typescript-16-reflect-metadata",
      "slug": "reflect-metadata",
      "title": "reflect-metadata and design-time type information",
      "order": 3
    },
    {
      "id": "typescript-16-decorators-in-frameworks",
      "slug": "decorators-in-frameworks",
      "title": "Decorators in Angular, NestJS, and class-validator",
      "order": 4
    }
  ]
}
