{
  "id": "csharp-01-program-and-compilation",
  "slug": "program-and-compilation",
  "title": "How a C# program works",
  "order": 1,
  "stage": "foundation",
  "summary": "Learn what happens from the moment you write C# code to the moment it runs. This module covers how C# differs from JavaScript and TypeScript, the compile pipeline from source to machine code, project files and language versions, namespaces, entry points, and running a single file without a project.",
  "officialHubs": [
    {
      "title": "General structure of a C# program",
      "url": "https://learn.microsoft.com/en-us/dotnet/csharp/fundamentals/program-structure/"
    },
    {
      "title": "A tour of C#",
      "url": "https://learn.microsoft.com/en-us/dotnet/csharp/tour-of-csharp/overview"
    },
    {
      "title": "Configure C# language version",
      "url": "https://learn.microsoft.com/en-us/dotnet/csharp/language-reference/configure-language-version"
    }
  ],
  "topics": [
    {
      "id": "csharp-01-csharp-vs-js-ts",
      "slug": "csharp-vs-js-ts",
      "title": "What C# is (compared to JavaScript and TypeScript)",
      "order": 1
    },
    {
      "id": "csharp-01-compilation-pipeline",
      "slug": "compilation-pipeline",
      "title": "How C# code becomes running programs (source, IL, JIT, AOT)",
      "order": 2
    },
    {
      "id": "csharp-01-sdk-project-language-version",
      "slug": "sdk-project-language-version",
      "title": "Project files, language version, and auto-imports",
      "order": 3
    },
    {
      "id": "csharp-01-namespaces-and-usings",
      "slug": "namespaces-and-usings",
      "title": "Organizing code with namespaces and using statements",
      "order": 4
    },
    {
      "id": "csharp-01-entry-points",
      "slug": "entry-points",
      "title": "Where your program starts (Main and top-level statements)",
      "order": 5
    },
    {
      "id": "csharp-01-file-based-apps",
      "slug": "file-based-apps",
      "title": "Running a single C# file without a project",
      "order": 6
    }
  ]
}
