{
  "id": "javascript-07-null-undefined-optional",
  "slug": "null-undefined-optional",
  "title": "null, undefined, and optional access",
  "order": 7,
  "stage": "foundation",
  "summary": "null versus undefined, optional chaining, nullish coalescing, defensive coding, and comparisons to C# nullable reference types and TypeScript strictNullChecks.",
  "officialHubs": [
    {
      "title": "MDN JavaScript guide",
      "url": "https://developer.mozilla.org/en-US/docs/Web/JavaScript/Guide"
    },
    {
      "title": "javascript.info",
      "url": "https://javascript.info/"
    }
  ],
  "topics": [
    {
      "id": "javascript-07-null-vs-undefined",
      "slug": "null-vs-undefined",
      "title": "null versus undefined and when each appears",
      "order": 1
    },
    {
      "id": "javascript-07-optional-chaining",
      "slug": "optional-chaining",
      "title": "Optional chaining (?.) and safe navigation",
      "order": 2
    },
    {
      "id": "javascript-07-nullish-coalescing",
      "slug": "nullish-coalescing",
      "title": "Nullish coalescing (??) versus ||",
      "order": 3
    },
    {
      "id": "javascript-07-defensive-coding-patterns",
      "slug": "defensive-coding-patterns",
      "title": "Defensive checks, defaults, and guard clauses",
      "order": 4
    },
    {
      "id": "javascript-07-null-safety-vs-typescript-nrt",
      "slug": "null-safety-vs-typescript-nrt",
      "title": "JavaScript null safety versus TypeScript and C# NRT",
      "order": 5
    }
  ]
}
