{
  "id": "javascript-03-types-coercion-equality",
  "slug": "types-coercion-equality",
  "title": "Dynamic types, coercion, and equality",
  "order": 3,
  "stage": "foundation",
  "summary": "typeof, primitives versus objects, implicit and explicit coercion, == versus ===, Symbol, BigInt, and how JavaScript type behavior differs from C# static types and TypeScript annotations.",
  "officialHubs": [
    {
      "title": "MDN JavaScript guide",
      "url": "https://developer.mozilla.org/en-US/docs/Web/JavaScript/Guide"
    },
    {
      "title": "javascript.info",
      "url": "https://javascript.info/"
    }
  ],
  "topics": [
    {
      "id": "javascript-03-primitives-and-objects",
      "slug": "primitives-and-objects",
      "title": "Primitives versus objects (and why typeof lies)",
      "order": 1
    },
    {
      "id": "javascript-03-typeof-and-type-checks",
      "slug": "typeof-and-type-checks",
      "title": "typeof, instanceof, and safe type checks",
      "order": 2
    },
    {
      "id": "javascript-03-coercion-rules",
      "slug": "coercion-rules",
      "title": "Implicit and explicit coercion (+, ToNumber, ToString)",
      "order": 3
    },
    {
      "id": "javascript-03-equality-and-comparison",
      "slug": "equality-and-comparison",
      "title": "== versus ===, Object.is, and SameValueZero",
      "order": 4
    },
    {
      "id": "javascript-03-symbol-and-bigint",
      "slug": "symbol-and-bigint",
      "title": "Symbol and BigInt in modern JavaScript",
      "order": 5
    },
    {
      "id": "javascript-03-truthiness-and-falsy",
      "slug": "truthiness-and-falsy",
      "title": "Truthiness, falsy values, and guard patterns",
      "order": 6
    },
    {
      "id": "javascript-03-dynamic-vs-static-types",
      "slug": "dynamic-vs-static-types",
      "title": "Dynamic typing versus C# and TypeScript static types",
      "order": 7
    },
    {
      "id": "javascript-03-json-and-serialization",
      "slug": "json-and-serialization",
      "title": "JSON.stringify, parse, and structured clone",
      "order": 8
    }
  ]
}
