{
  "id": "aws-12-sqs-messaging",
  "slug": "sqs-messaging",
  "title": "Amazon SQS messaging patterns",
  "order": 12,
  "stage": "intermediate",
  "summary": "Amazon Simple Queue Service (SQS) decouples producers from consumers with durable, managed queues. Learn Standard versus First-In-First-Out (FIFO) semantics, visibility timeout and Dead Letter Queues (DLQs), Lambda event source mappings, fan-out with Amazon Simple Notification Service (SNS) and EventBridge, and idempotent consumer design — the patterns senior interviews probe when debugging duplicate processing or poison messages.",
  "officialHubs": [
    {
      "title": "Amazon SQS developer guide",
      "url": "https://docs.aws.amazon.com/AWSSimpleQueueService/latest/SQSDeveloperGuide/welcome.html"
    },
    {
      "title": "AWS Well-Architected — Reliability",
      "url": "https://docs.aws.amazon.com/wellarchitected/latest/reliability-pillar/welcome.html"
    }
  ],
  "topics": [
    {
      "id": "aws-12-sqs-standard-vs-fifo",
      "slug": "sqs-standard-vs-fifo",
      "title": "SQS Standard versus FIFO queues (ordering, throughput, and deduplication)",
      "order": 1
    },
    {
      "id": "aws-12-sqs-visibility-dlq",
      "slug": "sqs-visibility-dlq",
      "title": "Visibility timeout, retries, and Dead Letter Queues (DLQ)",
      "order": 2
    },
    {
      "id": "aws-12-sqs-lambda-consumer",
      "slug": "sqs-lambda-consumer",
      "title": "Lambda as an SQS consumer (batching, partial failure, and scaling)",
      "order": 3
    },
    {
      "id": "aws-12-sns-eventbridge-sqs",
      "slug": "sns-eventbridge-sqs",
      "title": "SNS and EventBridge fan-out to SQS",
      "order": 4
    },
    {
      "id": "aws-12-sqs-idempotency",
      "slug": "sqs-idempotency",
      "title": "Idempotent SQS consumers (at-least-once delivery)",
      "order": 5
    }
  ]
}
