{
  "id": "javascript-15-workers-and-concurrency",
  "slug": "workers-and-concurrency",
  "title": "Web Workers, SharedArrayBuffer, and concurrency",
  "order": 15,
  "stage": "advanced",
  "summary": "Worker threads, postMessage, transferable objects, Atomics, SharedArrayBuffer, and when to use Workers versus async I/O.",
  "officialHubs": [
    {
      "title": "MDN JavaScript guide",
      "url": "https://developer.mozilla.org/en-US/docs/Web/JavaScript/Guide"
    },
    {
      "title": "javascript.info",
      "url": "https://javascript.info/"
    }
  ],
  "topics": [
    {
      "id": "javascript-15-web-workers-basics",
      "slug": "web-workers-basics",
      "title": "Web Workers and dedicated worker threads",
      "order": 1
    },
    {
      "id": "javascript-15-postmessage-and-transferables",
      "slug": "postmessage-and-transferables",
      "title": "postMessage, structured clone, and transferables",
      "order": 2
    },
    {
      "id": "javascript-15-sharedarraybuffer-and-atomics",
      "slug": "sharedarraybuffer-and-atomics",
      "title": "SharedArrayBuffer and Atomics",
      "order": 3
    },
    {
      "id": "javascript-15-worker-pools-and-patterns",
      "slug": "worker-pools-and-patterns",
      "title": "Worker pools and offloading CPU work",
      "order": 4
    },
    {
      "id": "javascript-15-workers-vs-csharp-threading",
      "slug": "workers-vs-csharp-threading",
      "title": "Workers versus C# threads and Task.Run",
      "order": 5
    }
  ]
}
