{
  "id": "csharp-09-generics",
  "slug": "generics",
  "title": "Generics",
  "order": 9,
  "stage": "intermediate",
  "summary": "Generics keep type safety without ArrayList casts or boxing. This module covers why they exist, generic types versus methods, constraints (class, struct, new(), notnull, unmanaged, Enum, Delegate, allows ref struct), covariance/contravariance versus TypeScript, and a production Result<T> wrapper for cache and API outcomes.",
  "officialHubs": [
    {
      "title": "Generic types and methods",
      "url": "https://learn.microsoft.com/en-us/dotnet/csharp/fundamentals/types/generics"
    },
    {
      "title": "Constraints on type parameters",
      "url": "https://learn.microsoft.com/en-us/dotnet/csharp/programming-guide/generics/constraints-on-type-parameters"
    },
    {
      "title": "Covariance and contravariance",
      "url": "https://learn.microsoft.com/en-us/dotnet/standard/generics/covariance-and-contravariance"
    }
  ],
  "topics": [
    {
      "id": "csharp-09-why-generics",
      "slug": "why-generics",
      "title": "Why generics: List versus ArrayList",
      "order": 1
    },
    {
      "id": "csharp-09-generic-types-and-methods",
      "slug": "generic-types-and-methods",
      "title": "Generic types and methods",
      "order": 2
    },
    {
      "id": "csharp-09-constraints",
      "slug": "constraints",
      "title": "Constraints on type parameters",
      "order": 3
    },
    {
      "id": "csharp-09-variance",
      "slug": "variance",
      "title": "Variance versus TypeScript",
      "order": 4
    },
    {
      "id": "csharp-09-generic-result-wrapper",
      "slug": "generic-result-wrapper",
      "title": "A generic Result wrapper for cache and APIs",
      "order": 5
    }
  ]
}
