{
  "id": "aws-05-vpc-fundamentals",
  "slug": "vpc-fundamentals",
  "title": "VPC fundamentals (subnets, routing, DNS, NAT)",
  "order": 5,
  "stage": "foundation",
  "summary": "Build a secure Amazon Virtual Private Cloud (VPC) from the ground up: Classless Inter-Domain Routing (CIDR) planning, public versus private subnets, Internet Gateway and Network Address Translation (NAT) Gateway egress paths, route tables with packet walkthroughs, VPC Domain Name System (DNS), Elastic IP versus ephemeral public IP, and multi-Availability Zone design patterns for production workloads.",
  "officialHubs": [
    {
      "title": "Amazon VPC User Guide",
      "url": "https://docs.aws.amazon.com/vpc/latest/userguide/what-is-amazon-vpc.html"
    },
    {
      "title": "VPC with public and private subnets",
      "url": "https://docs.aws.amazon.com/vpc/latest/userguide/VPC_Scenario2.html"
    }
  ],
  "topics": [
    {
      "id": "aws-05-aws-vpc-cidr-subnets",
      "slug": "aws-vpc-cidr-subnets",
      "title": "VPC, CIDR planning, and public versus private subnets",
      "order": 1
    },
    {
      "id": "aws-05-aws-internet-gateway",
      "slug": "aws-internet-gateway",
      "title": "Internet Gateway and internet egress paths",
      "order": 2
    },
    {
      "id": "aws-05-aws-nat-gateway",
      "slug": "aws-nat-gateway",
      "title": "NAT Gateway versus alternatives (NAT instance, egress-only)",
      "order": 3
    },
    {
      "id": "aws-05-aws-route-tables",
      "slug": "aws-route-tables",
      "title": "Route tables and packet walkthrough diagrams",
      "order": 4
    },
    {
      "id": "aws-05-aws-vpc-dns",
      "slug": "aws-vpc-dns",
      "title": "VPC DNS hostnames and resolver behavior",
      "order": 5
    },
    {
      "id": "aws-05-aws-elastic-vs-ephemeral-ip",
      "slug": "aws-elastic-vs-ephemeral-ip",
      "title": "Elastic IP versus ephemeral public IP",
      "order": 6
    },
    {
      "id": "aws-05-aws-multi-az-vpc-patterns",
      "slug": "aws-multi-az-vpc-patterns",
      "title": "Multi-Availability Zone VPC design patterns",
      "order": 7
    }
  ]
}
