{
  "id": "javascript-17-browser-node-runtimes",
  "slug": "browser-node-runtimes",
  "title": "Browser versus Node.js runtimes",
  "order": 17,
  "stage": "advanced",
  "summary": "Global objects, fetch, streams, timers, process, Buffer, fs promises, and environment-specific APIs.",
  "officialHubs": [
    {
      "title": "MDN JavaScript guide",
      "url": "https://developer.mozilla.org/en-US/docs/Web/JavaScript/Guide"
    },
    {
      "title": "javascript.info",
      "url": "https://javascript.info/"
    }
  ],
  "topics": [
    {
      "id": "javascript-17-global-objects-window-process",
      "slug": "global-objects-window-process",
      "title": "window, globalThis, process, and environment globals",
      "order": 1
    },
    {
      "id": "javascript-17-fetch-streams-and-web-apis",
      "slug": "fetch-streams-and-web-apis",
      "title": "fetch, ReadableStream, and Web Streams API",
      "order": 2
    },
    {
      "id": "javascript-17-timers-and-nexttick",
      "slug": "timers-and-nexttick",
      "title": "setTimeout, setImmediate, queueMicrotask, and process.nextTick",
      "order": 3
    },
    {
      "id": "javascript-17-node-fs-and-buffers",
      "slug": "node-fs-and-buffers",
      "title": "Node.js fs/promises, Buffer, and path differences",
      "order": 4
    }
  ]
}
