{
  "id": "typescript-03-type-system-unions-intersections",
  "slug": "type-system-unions-intersections",
  "title": "The type system: unions, intersections, and widening",
  "order": 3,
  "stage": "foundation",
  "summary": "Union and intersection types, discriminated unions preview, type widening and narrowing basics, and assignability rules.",
  "officialHubs": [
    {
      "title": "TypeScript handbook",
      "url": "https://www.typescriptlang.org/docs/handbook/intro.html"
    },
    {
      "title": "TypeScript release notes",
      "url": "https://www.typescriptlang.org/docs/handbook/release-notes/overview.html"
    }
  ],
  "topics": [
    {
      "id": "typescript-03-union-types",
      "slug": "union-types",
      "title": "Union types (A | B) and exhaustiveness",
      "order": 1
    },
    {
      "id": "typescript-03-intersection-types",
      "slug": "intersection-types",
      "title": "Intersection types (A & B) and mixing shapes",
      "order": 2
    },
    {
      "id": "typescript-03-widening-and-narrowing-basics",
      "slug": "widening-and-narrowing-basics",
      "title": "Type widening, narrowing, and control flow",
      "order": 3
    },
    {
      "id": "typescript-03-assignability-and-subtyping",
      "slug": "assignability-and-subtyping",
      "title": "Assignability, subtyping, and excess property checks",
      "order": 4
    },
    {
      "id": "typescript-03-discriminated-unions-intro",
      "slug": "discriminated-unions-intro",
      "title": "Discriminated unions and tagged unions",
      "order": 5
    },
    {
      "id": "typescript-03-readonly-and-immutability",
      "slug": "readonly-and-immutability",
      "title": "readonly, Readonly<T>, and immutability flags",
      "order": 6
    },
    {
      "id": "typescript-03-index-signatures",
      "slug": "index-signatures",
      "title": "Index signatures and Record<K, V>",
      "order": 7
    },
    {
      "id": "typescript-03-type-system-vs-csharp",
      "slug": "type-system-vs-csharp",
      "title": "TypeScript structural types versus C# nominal types",
      "order": 8
    }
  ]
}
