{
  "id": "dotnet-10-caching-performance-resilience",
  "slug": "caching-performance-resilience",
  "title": "Caching, performance, and resilience",
  "order": 10,
  "stage": "advanced",
  "summary": "In-memory and distributed caching, response and output caching, rate limiting, Polly resilience, async API performance, and diagnosing slow endpoints under load.",
  "officialHubs": [
    { "title": "Caching in ASP.NET Core", "url": "https://learn.microsoft.com/en-us/aspnet/core/performance/caching/overview" },
    { "title": "Rate limiting middleware", "url": "https://learn.microsoft.com/en-us/aspnet/core/performance/rate-limit" }
  ],
  "topics": [
    { "id": "dotnet-10-in-memory-distributed-cache", "slug": "in-memory-distributed-cache", "title": "IMemoryCache and IDistributedCache (Redis-backed)", "order": 1 },
    { "id": "dotnet-10-response-output-caching", "slug": "response-output-caching", "title": "Response caching and output caching middleware", "order": 2 },
    { "id": "dotnet-10-rate-limiting", "slug": "rate-limiting", "title": "Rate limiting (fixed window, sliding window, concurrency)", "order": 3 },
    { "id": "dotnet-10-polly-resilience", "slug": "polly-resilience", "title": "Polly resilience (retry, circuit breaker, timeout)", "order": 4 },
    { "id": "dotnet-10-async-api-performance", "slug": "async-api-performance", "title": "Async API performance (thread-pool starvation, sync-over-async)", "order": 5 },
    { "id": "dotnet-10-ef-query-performance", "slug": "ef-query-performance", "title": "EF Core query performance (compiled queries, indexes, execution plans)", "order": 6 },
    { "id": "dotnet-10-diagnosing-slow-apis", "slug": "diagnosing-slow-apis", "title": "Diagnosing slow APIs (dotnet-counters, traces, p95 latency)", "order": 7 }
  ]
}
