{
  "id": "aws-06-vpc-connectivity",
  "slug": "vpc-connectivity",
  "title": "VPC connectivity (endpoints, peering, hybrid)",
  "order": 6,
  "stage": "foundation",
  "summary": "Connect Virtual Private Clouds (VPCs) to AWS services and to each other without exposing traffic to the public internet. Gateway and Interface VPC endpoints, VPC peering limits, Transit Gateway hub-and-spoke, Site-to-Site VPN and Direct Connect, AWS PrivateLink, and an end-to-end hybrid walkthrough.",
  "officialHubs": [
    {
      "title": "AWS VPC connectivity options",
      "url": "https://docs.aws.amazon.com/vpc/latest/userguide/what-is-amazon-vpc.html"
    },
    {
      "title": "AWS PrivateLink",
      "url": "https://docs.aws.amazon.com/vpc/latest/privatelink/what-is-privatelink.html"
    }
  ],
  "topics": [
    {
      "id": "aws-06-vpc-endpoints",
      "slug": "vpc-endpoints",
      "title": "VPC endpoints (Gateway versus Interface)",
      "order": 1
    },
    {
      "id": "aws-06-vpc-peering",
      "slug": "vpc-peering",
      "title": "VPC peering (transitive routing limits)",
      "order": 2
    },
    {
      "id": "aws-06-transit-gateway",
      "slug": "transit-gateway",
      "title": "Transit Gateway (hub-and-spoke)",
      "order": 3
    },
    {
      "id": "aws-06-vpn-direct-connect",
      "slug": "vpn-direct-connect",
      "title": "Site-to-Site VPN and Direct Connect (overview)",
      "order": 4
    },
    {
      "id": "aws-06-privatelink",
      "slug": "privatelink",
      "title": "AWS PrivateLink (private service access)",
      "order": 5
    },
    {
      "id": "aws-06-hybrid-scenario",
      "slug": "hybrid-scenario",
      "title": "End-to-end hybrid scenario walkthrough",
      "order": 6
    }
  ]
}
