{
  "id": "aws-17-cloud-foundation",
  "slug": "cloud-foundation",
  "title": "Cloud foundation (landing zones and guardrails)",
  "order": 17,
  "stage": "advanced",
  "summary": "Build enterprise cloud foundations with landing zones, account vending, guardrails, hub-and-spoke networking, identity federation, and centralized logging baselines. Patterns from AWS Cloud Foundation and Control Tower prescriptive guidance.",
  "officialHubs": [
    {
      "title": "AWS Cloud Foundation",
      "url": "https://docs.aws.amazon.com/prescriptive-guidance/latest/migration-aws-environment/welcome.html"
    },
    {
      "title": "AWS Control Tower",
      "url": "https://docs.aws.amazon.com/controltower/latest/userguide/what-is-control-tower.html"
    }
  ],
  "topics": [
    { "id": "aws-17-landing-zone-concept", "slug": "landing-zone-concept", "title": "Landing zone concept (multi-account foundation)", "order": 1 },
    { "id": "aws-17-account-vending-guardrails", "slug": "account-vending-guardrails", "title": "Account vending and guardrails (SCPs and policies)", "order": 2 },
    { "id": "aws-17-network-foundation-hub-spoke", "slug": "network-foundation-hub-spoke", "title": "Network foundation (hub-and-spoke topology)", "order": 3 },
    { "id": "aws-17-identity-foundation-sso", "slug": "identity-foundation-sso", "title": "Identity foundation (IAM Identity Center SSO)", "order": 4 },
    { "id": "aws-17-centralized-logging-baseline", "slug": "centralized-logging-baseline", "title": "Centralized logging baseline (audit and operations)", "order": 5 }
  ]
}
