{
  "id": "javascript-10-callbacks-events-hof",
  "slug": "callbacks-events-hof",
  "title": "Callbacks, events, and the observer pattern",
  "order": 10,
  "stage": "intermediate",
  "summary": "Callback hell, EventEmitter, DOM events, delegation, pub/sub, and building small observer APIs from scratch.",
  "officialHubs": [
    {
      "title": "MDN JavaScript guide",
      "url": "https://developer.mozilla.org/en-US/docs/Web/JavaScript/Guide"
    },
    {
      "title": "javascript.info",
      "url": "https://javascript.info/"
    }
  ],
  "topics": [
    {
      "id": "javascript-10-callback-patterns",
      "slug": "callback-patterns",
      "title": "Callback patterns and error-first conventions",
      "order": 1
    },
    {
      "id": "javascript-10-event-emitter",
      "slug": "event-emitter",
      "title": "EventEmitter and custom pub/sub APIs",
      "order": 2
    },
    {
      "id": "javascript-10-dom-events-and-delegation",
      "slug": "dom-events-and-delegation",
      "title": "DOM events, bubbling, capturing, and delegation",
      "order": 3
    },
    {
      "id": "javascript-10-callback-hell-and-composition",
      "slug": "callback-hell-and-composition",
      "title": "Callback hell and composing async before Promises",
      "order": 4
    },
    {
      "id": "javascript-10-debounce-throttle-implementations",
      "slug": "debounce-throttle-implementations",
      "title": "Implementing debounce and throttle from scratch",
      "order": 5
    },
    {
      "id": "javascript-10-events-vs-csharp-delegates",
      "slug": "events-vs-csharp-delegates",
      "title": "JavaScript events versus C# delegates and events",
      "order": 6
    }
  ]
}
